{
  "epistemic_mode": "GROUNDED",
  "experiment": {
    "action": "single_point"
  },
  "matter": {
    "atoms": [
      {
        "element": "C",
        "xyz_angstrom": [
          0.0,
          0.0,
          0.0
        ]
      },
      {
        "element": "C",
        "xyz_angstrom": [
          0.8925,
          0.8925,
          0.8925
        ]
      }
    ],
    "cell_angstrom": [
      [
        0.0,
        1.785,
        1.785
      ],
      [
        1.785,
        0.0,
        1.785
      ],
      [
        1.785,
        1.785,
        0.0
      ]
    ],
    "charge": 0,
    "periodic": true,
    "source": "QW-PERIODIC02 AI-authored prototype; geometry is a proposal",
    "spin_2S": 0,
    "type": "periodic_cell"
  },
  "object_id": "QW_P02_C_DIAMOND_2ATOM_KRKS_222",
  "physics": {
    "basis": "cc-pvdz",
    "engine": "pyscf-pbc",
    "k_sampling": {
      "coordinate_unit": "1/Bohr",
      "generator": "cell.make_kpts",
      "mesh": [
        2,
        2,
        2
      ],
      "symmetry_reduction": false,
      "weights": "uniform",
      "with_gamma_point": true,
      "wrap_around": true
    },
    "method": "KRKS",
    "numerics": {
      "Becke_level": 1,
      "cell_precision": 1e-06,
      "conv_tol": 1e-08,
      "max_cycle": 80
    },
    "observables": [
      "energy"
    ],
    "xc": "PBE"
  },
  "version": "QW-WORLDSPEC-0.1"
}
