{
  "epistemic_mode": "GROUNDED",
  "experiment": {
    "action": "single_point"
  },
  "matter": {
    "atoms": [
      {
        "element": "C",
        "xyz_angstrom": [
          0.0,
          0.0,
          0.0
        ]
      },
      {
        "element": "C",
        "xyz_angstrom": [
          0.8925,
          0.8925,
          0.8925
        ]
      }
    ],
    "cell_angstrom": [
      [
        0.0,
        1.785,
        1.785
      ],
      [
        1.785,
        0.0,
        1.785
      ],
      [
        1.785,
        1.785,
        0.0
      ]
    ],
    "charge": 0,
    "periodic": true,
    "source": "QW-PERIODIC02 AI-authored prototype; geometry is a proposal",
    "spin_2S": 0,
    "type": "periodic_cell"
  },
  "object_id": "QW_P02_C_DIAMOND_2ATOM",
  "physics": {
    "basis": "cc-pvdz",
    "engine": "pyscf-pbc",
    "method": "RKS",
    "observables": [
      "energy"
    ],
    "xc": "PBE"
  },
  "version": "QW-WORLDSPEC-0.1"
}
