{
  "epistemic_mode": "GROUNDED",
  "experiment": {
    "action": "single_point"
  },
  "matter": {
    "atoms": [
      {
        "element": "Mg",
        "xyz_angstrom": [
          0.0,
          0.0,
          0.0
        ]
      },
      {
        "element": "O",
        "xyz_angstrom": [
          2.155,
          2.105,
          2.105
        ]
      }
    ],
    "cell_angstrom": [
      [
        0.0,
        2.105,
        2.105
      ],
      [
        2.105,
        0.0,
        2.105
      ],
      [
        2.105,
        2.105,
        0.0
      ]
    ],
    "charge": 0,
    "periodic": true,
    "source": "Inherited unused MgO proposal; geometry input, not equilibrium or stability proof",
    "spin_2S": 0,
    "type": "periodic_cell"
  },
  "object_id": "QW_I01_MGO_INITIAL",
  "physics": {
    "basis": "cc-pvdz",
    "engine": "pyscf-pbc",
    "k_sampling": {
      "coordinate_unit": "1/Bohr",
      "generator": "cell.make_kpts",
      "mesh": [
        1,
        1,
        1
      ],
      "symmetry_reduction": false,
      "weights": "uniform",
      "with_gamma_point": true,
      "wrap_around": true
    },
    "method": "KRKS",
    "numerics": {
      "Becke_level": 1,
      "cell_precision": 1e-06,
      "conv_tol": 1e-08,
      "max_cycle": 80
    },
    "observables": [
      "energy"
    ],
    "xc": "PBE"
  },
  "version": "QW-WORLDSPEC-0.1"
}
